{
  "v": 1,
  "id": "11111111-2222-4333-8444-555555555501",
  "type": "file.offer",
  "ts": 1791500400000,
  "body": { "transferId": "a1b2c3d4-e5f6-4789-8abc-def012345678", "name": "holiday.jpg", "size": 3145728, "mime": "image/jpeg", "sha256": "9f86d081884c7d659a2feaa0c55ad015a3bf4f1b2b0b822cd15d6c15b0f00a08" }
}
